{
  "$schema": "https://json-schema.org/draft/2020-12/schema",
  "$id": "https://github.com/aponiajs/aponiajs/blob/main/roadmap/roadmap.schema.json",
  "title": "AponiaJS Roadmap",
  "description": "Machine-readable product and engineering roadmap for AponiaJS.",
  "type": "object",
  "additionalProperties": false,
  "required": [
    "$schema",
    "schemaVersion",
    "generatedAt",
    "project",
    "statusDefinitions",
    "summary",
    "milestones",
    "items"
  ],
  "properties": {
    "$schema": {
      "type": "string"
    },
    "schemaVersion": {
      "const": "1.0.0"
    },
    "generatedAt": {
      "type": "string",
      "pattern": "^\\d{4}-\\d{2}-\\d{2}T\\d{2}:\\d{2}:\\d{2}Z$"
    },
    "project": {
      "type": "object",
      "additionalProperties": false,
      "required": [
        "id",
        "name",
        "description",
        "repository",
        "defaultBranch",
        "currentVersion",
        "runtime",
        "packageManager",
        "sourceCommit"
      ],
      "properties": {
        "id": {
          "type": "string",
          "pattern": "^[a-z0-9]+(?:-[a-z0-9]+)*$"
        },
        "name": {
          "type": "string",
          "minLength": 1
        },
        "description": {
          "type": "string",
          "minLength": 1
        },
        "repository": {
          "type": "string",
          "pattern": "^https://github\\.com/"
        },
        "defaultBranch": {
          "type": "string",
          "minLength": 1
        },
        "currentVersion": {
          "type": "string",
          "pattern": "^\\d+\\.\\d+\\.\\d+(?:-[0-9A-Za-z.-]+)?$"
        },
        "runtime": {
          "type": "string",
          "minLength": 1
        },
        "packageManager": {
          "type": "string",
          "minLength": 1
        },
        "sourceCommit": {
          "type": "string",
          "pattern": "^[0-9a-f]{40}$"
        }
      }
    },
    "statusDefinitions": {
      "type": "object",
      "additionalProperties": false,
      "required": ["completed", "in_progress", "planned"],
      "properties": {
        "completed": {
          "$ref": "#/$defs/statusDefinition"
        },
        "in_progress": {
          "$ref": "#/$defs/statusDefinition"
        },
        "planned": {
          "$ref": "#/$defs/statusDefinition"
        }
      }
    },
    "summary": {
      "type": "object",
      "additionalProperties": false,
      "required": ["total", "completed", "inProgress", "planned", "completionPercent"],
      "properties": {
        "total": {
          "type": "integer",
          "minimum": 0
        },
        "completed": {
          "type": "integer",
          "minimum": 0
        },
        "inProgress": {
          "type": "integer",
          "minimum": 0
        },
        "planned": {
          "type": "integer",
          "minimum": 0
        },
        "completionPercent": {
          "type": "number",
          "minimum": 0,
          "maximum": 100
        }
      }
    },
    "milestones": {
      "type": "array",
      "minItems": 1,
      "items": {
        "$ref": "#/$defs/milestone"
      }
    },
    "items": {
      "type": "array",
      "minItems": 1,
      "items": {
        "$ref": "#/$defs/roadmapItem"
      }
    }
  },
  "$defs": {
    "status": {
      "enum": ["completed", "in_progress", "planned"]
    },
    "statusDefinition": {
      "type": "object",
      "additionalProperties": false,
      "required": ["label", "description", "order", "color"],
      "properties": {
        "label": {
          "type": "string",
          "minLength": 1
        },
        "description": {
          "type": "string",
          "minLength": 1
        },
        "order": {
          "type": "integer",
          "minimum": 1
        },
        "color": {
          "type": "string",
          "pattern": "^#[0-9A-Fa-f]{6}$"
        }
      }
    },
    "milestone": {
      "type": "object",
      "additionalProperties": false,
      "required": ["id", "title", "description", "order", "status", "progressPercent", "itemIds"],
      "properties": {
        "id": {
          "type": "string",
          "pattern": "^milestone-[a-z0-9]+(?:-[a-z0-9]+)*$"
        },
        "title": {
          "type": "string",
          "minLength": 1
        },
        "description": {
          "type": "string",
          "minLength": 1
        },
        "order": {
          "type": "integer",
          "minimum": 1
        },
        "status": {
          "$ref": "#/$defs/status"
        },
        "progressPercent": {
          "type": "number",
          "minimum": 0,
          "maximum": 100
        },
        "targetVersion": {
          "type": ["string", "null"],
          "pattern": "^\\d+\\.\\d+\\.\\d+(?:-[0-9A-Za-z.-]+)?$"
        },
        "itemIds": {
          "type": "array",
          "minItems": 1,
          "uniqueItems": true,
          "items": {
            "type": "string",
            "pattern": "^[a-z0-9]+(?:-[a-z0-9]+)*$"
          }
        }
      }
    },
    "evidence": {
      "type": "object",
      "additionalProperties": false,
      "required": ["kind", "label", "ref"],
      "properties": {
        "kind": {
          "enum": ["file", "documentation", "pull_request", "workflow", "npm", "plan"]
        },
        "label": {
          "type": "string",
          "minLength": 1
        },
        "ref": {
          "type": "string",
          "minLength": 1
        }
      }
    },
    "roadmapItem": {
      "type": "object",
      "additionalProperties": false,
      "required": [
        "id",
        "milestoneId",
        "title",
        "description",
        "status",
        "progressPercent",
        "priority",
        "category",
        "packages",
        "dependencies",
        "deliverables",
        "evidence",
        "acceptanceCriteria",
        "nextActions",
        "updatedAt",
        "tags"
      ],
      "properties": {
        "id": {
          "type": "string",
          "pattern": "^[a-z0-9]+(?:-[a-z0-9]+)*$"
        },
        "milestoneId": {
          "type": "string",
          "pattern": "^milestone-[a-z0-9]+(?:-[a-z0-9]+)*$"
        },
        "title": {
          "type": "string",
          "minLength": 1
        },
        "description": {
          "type": "string",
          "minLength": 1
        },
        "status": {
          "$ref": "#/$defs/status"
        },
        "progressPercent": {
          "type": "number",
          "minimum": 0,
          "maximum": 100
        },
        "priority": {
          "enum": ["critical", "high", "medium", "low"]
        },
        "category": {
          "enum": [
            "architecture",
            "runtime",
            "http",
            "security",
            "tooling",
            "release",
            "quality",
            "observability",
            "ecosystem",
            "documentation"
          ]
        },
        "packages": {
          "type": "array",
          "uniqueItems": true,
          "items": {
            "type": "string",
            "minLength": 1
          }
        },
        "dependencies": {
          "type": "array",
          "uniqueItems": true,
          "items": {
            "type": "string",
            "pattern": "^[a-z0-9]+(?:-[a-z0-9]+)*$"
          }
        },
        "deliverables": {
          "type": "array",
          "minItems": 1,
          "items": {
            "type": "string",
            "minLength": 1
          }
        },
        "evidence": {
          "type": "array",
          "minItems": 1,
          "items": {
            "$ref": "#/$defs/evidence"
          }
        },
        "acceptanceCriteria": {
          "type": "array",
          "minItems": 1,
          "items": {
            "type": "string",
            "minLength": 1
          }
        },
        "nextActions": {
          "type": "array",
          "items": {
            "type": "string",
            "minLength": 1
          }
        },
        "updatedAt": {
          "type": "string",
          "pattern": "^\\d{4}-\\d{2}-\\d{2}$"
        },
        "tags": {
          "type": "array",
          "uniqueItems": true,
          "items": {
            "type": "string",
            "pattern": "^[a-z0-9]+(?:-[a-z0-9]+)*$"
          }
        }
      }
    }
  }
}
