{
  "$schema": "./roadmap.schema.json",
  "schemaVersion": "1.0.0",
  "generatedAt": "2026-07-25T15:20:00Z",
  "project": {
    "id": "aponiajs",
    "name": "AponiaJS",
    "description": "A Bun-first, Nest-inspired application framework built around Elysia.",
    "repository": "https://github.com/aponiajs/aponiajs",
    "defaultBranch": "main",
    "currentVersion": "0.3.18",
    "runtime": "Bun 1.3.14",
    "packageManager": "Bun 1.3.14",
    "sourceCommit": "8e14611f2ccdeaccbe6fb5eac82e2b04ee36f770"
  },
  "statusDefinitions": {
    "completed": {
      "label": "Completed",
      "description": "Implemented and supported by repository or GitHub evidence.",
      "order": 1,
      "color": "#6FAF8A"
    },
    "in_progress": {
      "label": "In progress",
      "description": "An active workstream with implementation or maintenance remaining.",
      "order": 2,
      "color": "#E2A84A"
    },
    "planned": {
      "label": "Planned",
      "description": "Approved in the architecture plans but not implemented.",
      "order": 3,
      "color": "#8B8F97"
    }
  },
  "summary": {
    "total": 29,
    "completed": 12,
    "inProgress": 2,
    "planned": 15,
    "completionPercent": 45.17
  },
  "milestones": [
    {
      "id": "milestone-foundation-alpha",
      "title": "Foundation alpha",
      "description": "Workspace, authoring contracts, dependency injection, and the first Elysia application path.",
      "order": 1,
      "status": "completed",
      "progressPercent": 100,
      "targetVersion": "0.3.0",
      "itemIds": [
        "bun-workspace-toolchain",
        "common-authoring-api",
        "core-module-graph",
        "singleton-dependency-injection",
        "minimal-elysia-adapter",
        "logging-foundation"
      ]
    },
    {
      "id": "milestone-developer-experience",
      "title": "Developer experience",
      "description": "Application generation, Nest-style schematics, package documentation, and tracker-ready roadmap data.",
      "order": 2,
      "status": "completed",
      "progressPercent": 100,
      "targetVersion": "0.3.17",
      "itemIds": [
        "cli-application-generator",
        "cli-schematic-catalog",
        "automated-version-and-publish-flow",
        "published-package-documentation",
        "machine-readable-roadmap"
      ]
    },
    {
      "id": "milestone-release-quality",
      "title": "Release quality",
      "description": "Repeatable performance evidence, dependency maintenance, foundation hardening, and release-candidate gates.",
      "order": 3,
      "status": "in_progress",
      "progressPercent": 52.5,
      "targetVersion": "0.5.0",
      "itemIds": [
        "ci-benchmark-publication",
        "foundation-stabilization",
        "dependency-maintenance",
        "foundation-release-candidate"
      ]
    },
    {
      "id": "milestone-runtime-maturity",
      "title": "Runtime maturity",
      "description": "Provider lifecycles, package boundaries, native plugin inference, phase conformance, and response contracts.",
      "order": 4,
      "status": "planned",
      "progressPercent": 0,
      "targetVersion": "0.7.0",
      "itemIds": [
        "async-lifecycle-and-scopes",
        "platform-and-http-package-split",
        "native-plugin-type-inference",
        "elysia-lifecycle-conformance",
        "validation-errors-and-serialization"
      ]
    },
    {
      "id": "milestone-production-capabilities",
      "title": "Production capabilities",
      "description": "Configuration, security, authentication, rate limiting, testing, observability, OpenAPI, and optional decorators.",
      "order": 5,
      "status": "planned",
      "progressPercent": 0,
      "targetVersion": "1.0.0",
      "itemIds": [
        "configuration-secrets-and-redaction",
        "http-security-hardening",
        "authentication-and-authorization",
        "rate-limiting",
        "testing-packages",
        "observability-and-health",
        "openapi-and-eden",
        "decorators-package-extraction"
      ]
    },
    {
      "id": "milestone-ecosystem",
      "title": "Post-1.0 ecosystem",
      "description": "Additional transports and architecture packages after the HTTP foundation stabilizes.",
      "order": 6,
      "status": "planned",
      "progressPercent": 0,
      "targetVersion": "1.1.0",
      "itemIds": ["additional-transports-and-patterns"]
    }
  ],
  "items": [
    {
      "id": "bun-workspace-toolchain",
      "milestoneId": "milestone-foundation-alpha",
      "title": "Bun workspace and toolchain",
      "description": "Operate the repository as a Bun workspace with Vite+ checks, builds, and conformance tests.",
      "status": "completed",
      "progressPercent": 100,
      "priority": "critical",
      "category": "architecture",
      "packages": [],
      "dependencies": [],
      "deliverables": [
        "Bun workspace configuration",
        "Vite+ format, lint, type-check, build, and test lanes",
        "Pinned Bun runtime managed by mise"
      ],
      "evidence": [
        {
          "kind": "file",
          "label": "Workspace manifest",
          "ref": "package.json"
        },
        {
          "kind": "workflow",
          "label": "Continuous integration",
          "ref": ".github/workflows/ci.yml"
        }
      ],
      "acceptanceCriteria": [
        "A clean checkout installs, checks, tests, and builds with Bun-owned commands."
      ],
      "nextActions": [],
      "updatedAt": "2026-07-25",
      "tags": ["bun", "vite-plus", "workspace"]
    },
    {
      "id": "common-authoring-api",
      "milestoneId": "milestone-foundation-alpha",
      "title": "Common authoring API",
      "description": "Provide modules, controllers, routes, providers, typed tokens, decorators, errors, and logger contracts.",
      "status": "completed",
      "progressPercent": 100,
      "priority": "critical",
      "category": "architecture",
      "packages": ["@aponiajs/common"],
      "dependencies": ["bun-workspace-toolchain"],
      "deliverables": [
        "Functional module and provider descriptors",
        "Nest-inspired decorators",
        "Typed injection tokens and shared errors"
      ],
      "evidence": [
        {
          "kind": "file",
          "label": "Common package exports",
          "ref": "packages/common/src/index.ts"
        },
        {
          "kind": "documentation",
          "label": "Common package documentation",
          "ref": "packages/common/README.md"
        }
      ],
      "acceptanceCriteria": [
        "Consumers can author typed application metadata without importing Elysia."
      ],
      "nextActions": [],
      "updatedAt": "2026-07-25",
      "tags": ["contracts", "decorators", "tokens"]
    },
    {
      "id": "core-module-graph",
      "milestoneId": "milestone-foundation-alpha",
      "title": "Module graph compiler",
      "description": "Compile imports, exports, provider visibility, and deterministic dependency order with actionable diagnostics.",
      "status": "completed",
      "progressPercent": 100,
      "priority": "critical",
      "category": "runtime",
      "packages": ["@aponiajs/core"],
      "dependencies": ["common-authoring-api"],
      "deliverables": [
        "Module graph compilation",
        "Cycle, missing export, and ambiguity diagnostics",
        "Graph inspection output"
      ],
      "evidence": [
        {
          "kind": "file",
          "label": "Graph implementation",
          "ref": "packages/core/src/graph.ts"
        },
        {
          "kind": "file",
          "label": "Core graph tests",
          "ref": "packages/core/tests/core.test.ts"
        }
      ],
      "acceptanceCriteria": [
        "Invalid dependency graphs fail before application startup with a stable path."
      ],
      "nextActions": [],
      "updatedAt": "2026-07-25",
      "tags": ["module-graph", "diagnostics", "dependency-injection"]
    },
    {
      "id": "singleton-dependency-injection",
      "milestoneId": "milestone-foundation-alpha",
      "title": "Singleton dependency injection",
      "description": "Resolve value, factory, class, and alias providers through explicit dependencies.",
      "status": "completed",
      "progressPercent": 100,
      "priority": "critical",
      "category": "runtime",
      "packages": ["@aponiajs/core", "@aponiajs/common"],
      "dependencies": ["core-module-graph"],
      "deliverables": [
        "Singleton container",
        "Value, factory, class, and alias provider resolution",
        "Provider cycle detection"
      ],
      "evidence": [
        {
          "kind": "file",
          "label": "Container implementation",
          "ref": "packages/core/src/container.ts"
        },
        {
          "kind": "file",
          "label": "Container tests",
          "ref": "packages/core/tests/core.test.ts"
        }
      ],
      "acceptanceCriteria": [
        "Typed singleton chains resolve without reflection metadata or service-locator access."
      ],
      "nextActions": [],
      "updatedAt": "2026-07-25",
      "tags": ["container", "providers", "singleton"]
    },
    {
      "id": "minimal-elysia-adapter",
      "milestoneId": "milestone-foundation-alpha",
      "title": "Minimal Elysia adapter",
      "description": "Create an Aponia application, map decorated controllers to Elysia, handle requests, listen, and close.",
      "status": "completed",
      "progressPercent": 100,
      "priority": "critical",
      "category": "http",
      "packages": ["@aponiajs/platform-elysia"],
      "dependencies": ["singleton-dependency-injection"],
      "deliverables": [
        "AponiaFactory application bootstrap",
        "Decorated route mapping",
        "Native Elysia access and request handling"
      ],
      "evidence": [
        {
          "kind": "file",
          "label": "Application implementation",
          "ref": "packages/platform-elysia/src/application.ts"